category,title,creator,publication_year,description
book,Veranda Level,Geoffrey Deckow,1979,Aut illo delectus dolorem.
album,Heart Select,Jackelyn Doyle,2005,Quaerat quisquam labore consequatur.
book,Joe Choice,Erlinda Predovic DVM,2013,Est provident aut ab.
album,American Mug,Eusebio Dickinson,2014,Modi voluptate repudiandae voluptas.
book,Hello Java,Antione Klocko,1976,Consequatur ut odio nostrum.
album,Strong Utopia,Jerrold Witting,1935,Deleniti neque molestiae aut.
album,Split ,Miss Lacy Rutherford,1996,Et quia cum vero.
album,KrebStar Equinox,Mitch Upton,1966,Et non cum et.
album,Goodbye Enlightenment,Albina Reinger DVM,1994,Distinctio sed voluptas sit.
book,Postmodern Bean,Ms. Steven Ledner,2007,Sunt quaerat numquam amet.
book,Hello Mug,Dr. Martin Langosh,1949,Aut suscipit totam aut.
album,Seattle Select,Lekisha Schimmel,1940,Enim voluptas recusandae occaecati.
book,Brooklyn Solstice,Deedra Zulauf,1939,Autem quis sapiente porro.
book,Morning Treat,Krissy Hahn II,1971,Quisquam dolor laboriosam labore.
album,Winter Symphony,Luigi Rowe III,1991,Reiciendis dolor dolorem iusto.
book,Pumpkin-spice Volcano,Serina Monahan,2001,Officiis et ut et.
book,Express Breaker,Arlene Koepp,2017,Porro debitis aliquid ea.
book,Postmodern Symphony,Frederick Hintz,1966,Tempore sunt quam maxime.
book,Blacktop Pie,Noelle Hackett,1981,Iusto natus exercitationem sit.
book,Seattle Treat,Dorethea Stroman V,1995,Autem ea earum necessitatibus.
album,Wake-up Symphony,Clara Robel,1979,Doloremque et exercitationem labore.
book,Split Java,Robert Runolfsson,1927,Non delectus et dolor.
album,Evening ,Dr. Francis Koch,1955,Aperiam sunt sit dolores.
album,Café Bean,Sheena Langworth,1937,Quo rerum vitae architecto.
album,Jacked America,Janella Gutkowski PhD,1932,Inventore nam non autem.
