category,title,creator,publication_year,description
album,Blacktop Level,Preston Dibbert,1931,Soluta ducimus consectetur temporibus.
book,Joe Treat,Damien Keeling,1972,Doloribus omnis ad vitae.
album,American Treat,Hollis Zieme III,2015,Et aliquid ab ad.
album,The Select,Mrs. Darrell Kilback,1968,Unde pariatur rerum aut.
book,Strong Cake,Henriette Deckow,1958,Sed quia sed qui.
album,Wake-up Solstice,Eddie Marvin,1944,Consectetur qui voluptatem ut.
book,Blue Mug,Ben Weber,2012,Dolorem enim dolorem et.
album,Major ,Emilio Mueller,1972,Consequatur non sint voluptas.
album,Pumpkin-spice Volcano,Mr. Han Lockman,2004,Rem repellendus qui velit.
album,Seattle Cowboy,Mao Kuhic,2009,Aspernatur voluptates enim dicta.
book,Holiday Star,Miss Tommy Streich,1927,At delectus soluta et.
album,KrebStar Bean,Sandee Gerhold,1954,Est ipsam velit deleniti.
book,Veranda Forrester,Timothy Rau,1950,Ut vel esse ipsum.
book,Chocolate Equinox,Maureen Doyle DDS,1973,Eligendi sapiente et blanditiis.
book,Thanksgiving Enlightenment,Harry Wolf,2006,Tenetur velit excepturi laudantium.
book,Winter Select,Ivan Mosciski DDS,1984,Omnis distinctio non in.
album,Wake-up Enlightenment,Mr. Zenaida Mitchell,1971,Maiores exercitationem est dolor.
book,Pumpkin-spice Light,Cruz Armstrong,1998,Est dolor aut qui.
album,Veranda Nuts,Bradly Ruecker,1965,Eos quibusdam animi minus.
album,Wake-up Been,Leatha Grant,1999,Hic velit quia autem.
book,Pumpkin-spice ,Samual Murray,1971,Eaque pariatur tempore asperiores.
book,Reg's Coffee,Tawnya Hyatt,2012,Voluptatem dolorem dolores consequuntur.
book,Veranda Cup,Joel Dicki,1941,Voluptatem assumenda laborum et.
album,Seattle Enlightenment,Angie Labadie,1965,Eligendi culpa accusantium labore.
album,American Extract,Gregorio Wolf,1996,In similique qui earum.
