category,title,creator,publication_year,description
book,Brooklyn Pie,Gwendolyn Marquardt,1919,Optio vero quis cum.
book,Summer Equinox,Raphael McDermott,1955,Eum officia eveniet minus.
book,Huggy Utopia,Dr. Gregg Goodwin,1952,Tempore enim voluptate omnis.
book,Spilt Been,Jewell Fadel III,1993,Fugit libero eligendi consequuntur.
book,Hello Been,Olivia Bogisich,1956,Error quia quasi quas.
album,Goodbye Forrester,Don Effertz Sr.,2002,Sint nobis illum eius.
album,Holiday Mug,Ms. Gregg Kovacek,1977,Dolore eum dolorum aperiam.
album,Bluebery Volcano,Chester Becker,1931,Magni eos molestiae excepturi.
book,Dark Star,Leona Kilback,1976,Deserunt cumque qui non.
book,Dark Enlightenment,Ronny Stroman,1974,Assumenda repudiandae magnam aspernatur.
book,Cascara Forrester,Jarod Wiza,1954,Consequatur non dolor in.
album,Hello Treat,Ms. Wade Schumm,2002,Sit occaecati sit sint.
book,Good-morning Forrester,Lesley Casper,1921,Consequatur atque rem expedita.
album,The Equinox,Reggie Maggio,1941,Laborum ipsam accusantium et.
book,Chocolate Forrester,Silva Boyer,1942,Corporis et molestiae minima.
album,Green Been,Ms. Katerine Huel,1937,Incidunt officiis nesciunt expedita.
album,Reg's Cowboy,Cordell Will DVM,2012,Debitis enim consequatur vel.
album,Blue Enlightenment,Aurelio Weber,1937,Nulla voluptate aperiam aut.
album,Goodbye Light,Donald Russel,2010,Aut sequi soluta quisquam.
book,Thanksgiving Extract,Edwardo Runolfsdottir II,1972,Maxime in odio eos.
album,Express Utopia,Fritz Howe Sr.,1972,Ipsa non enim hic.
album,Goodbye ,Mr. Daren Schroeder,1984,Est molestiae quod necessitatibus.
book,Hello Cup,Chanell Waters,1969,Necessitatibus exercitationem explicabo aut.
book,Green Solstice,Paris Littel II,1938,Consectetur quasi unde eveniet.
book,Chocolate Select,Seth Kris,1983,Minus sapiente non aut.
